{
  "$schema": "https://json-schema.org/draft/2020-12/schema",
  "title": "crux council attempt record (format_version 1)",
  "description": "The claim one council attempt makes on a round, written and committed only by the council runner (crux/scripts/run-council.py) after preflight and before its secret scan, key check, seat assignment and first gateway request. Council execution begins at this claim. The attempt is resolved when exactly one committed format-2 council record names it by path, sha256 and attempt id, carries a seal that holds, and binds the same book, run, binding, round, question, subjects and registry; it is voided when a committed owner exception names it in `void_attempt`. Until then it is open, and its council gate stops at the contradicted-premise stop. An attempt takes no round place. The file name derives from the run, the module tag (or `p<prompt>` in a patch book), the round and the ordinal. `seal` is the sha256 of the canonical serialization (sorted keys, two-space indent, ASCII, one trailing newline) computed with `seal` set to null, and a reader requires the file's bytes to equal that serialization.",
  "type": "object",
  "additionalProperties": false,
  "required": [
    "record_type",
    "format_version",
    "writer",
    "attempt_id",
    "written_at",
    "book",
    "run_id",
    "binding",
    "council_kind",
    "round",
    "ordinal",
    "question",
    "subjects",
    "registry",
    "seal"
  ],
  "properties": {
    "record_type": {
      "const": "council-attempt"
    },
    "format_version": {
      "const": "1"
    },
    "writer": {
      "const": "run-council",
      "$comment": "The only attempt-record writer."
    },
    "attempt_id": {
      "type": "string",
      "pattern": "^[0-9a-f]{32}(?![\\s\\S])",
      "$comment": "A uuid4 in lowercase hex, without dashes."
    },
    "written_at": {
      "type": "string",
      "pattern": "^\\d{4}-\\d{2}-\\d{2}T\\d{2}:\\d{2}:\\d{2}\\.\\d{6}Z(?![\\s\\S])",
      "$comment": "UTC with microseconds, stamped by the council runner at the claim."
    },
    "book": {
      "type": "object",
      "additionalProperties": false,
      "required": [
        "id",
        "content_hash"
      ],
      "properties": {
        "id": {
          "type": "string",
          "pattern": "^(?:(?!(?:PB|ADR|RUN|BRIEF)-)[A-Z][A-Z0-9]{1,9}-)?PB-\\d{4}(?![\\s\\S])"
        },
        "content_hash": {
          "type": "string",
          "pattern": "^sha256:[0-9a-f]{64}(?![\\s\\S])"
        }
      }
    },
    "run_id": {
      "type": "string",
      "pattern": "^RUN-\\d{3}(?![\\s\\S])"
    },
    "binding": {
      "type": "object",
      "additionalProperties": false,
      "required": [
        "prompt",
        "module_tag"
      ],
      "$comment": "The claim's scope is the module (module_tag); a patch book's attempt is scoped to its prompt (module_tag null).",
      "properties": {
        "prompt": {
          "type": "integer",
          "minimum": 1
        },
        "module_tag": {
          "type": [
            "string",
            "null"
          ],
          "pattern": "^(adr|implementation|verify)-\\d+(?![\\s\\S])"
        }
      }
    },
    "council_kind": {
      "type": "string",
      "enum": [
        "adr",
        "implementation",
        "verify",
        "patch"
      ]
    },
    "round": {
      "type": "integer",
      "minimum": 1
    },
    "ordinal": {
      "type": "integer",
      "minimum": 1,
      "$comment": "One more than the attempts at this scope and round already resolved or voided."
    },
    "question": {
      "type": "object",
      "additionalProperties": false,
      "required": [
        "path",
        "sha256"
      ],
      "properties": {
        "path": {
          "type": "string",
          "minLength": 1,
          "$comment": "A path that matched the secret scan is written as \"[withheld: matched the secret scan]\"."
        },
        "sha256": {
          "type": "string",
          "pattern": "^[0-9a-f]{64}(?![\\s\\S])"
        }
      }
    },
    "subjects": {
      "type": "array",
      "minItems": 1,
      "items": {
        "type": "object",
        "additionalProperties": false,
        "required": [
          "path",
          "sha256"
        ],
        "properties": {
          "path": {
            "type": "string",
            "minLength": 1,
            "$comment": "Repository-relative, POSIX separators. A path that matched the secret scan is written as \"[withheld: matched the secret scan]\"."
          },
          "sha256": {
            "type": "string",
            "pattern": "^[0-9a-f]{64}(?![\\s\\S])"
          }
        }
      }
    },
    "registry": {
      "type": "object",
      "additionalProperties": false,
      "required": [
        "path",
        "sha256",
        "version"
      ],
      "$comment": "The router registry read before the claim; the council record reuses it.",
      "properties": {
        "path": {
          "type": "string",
          "minLength": 1
        },
        "sha256": {
          "type": "string",
          "pattern": "^[0-9a-f]{64}(?![\\s\\S])"
        },
        "version": {
          "type": [
            "string",
            "null"
          ]
        }
      }
    },
    "seal": {
      "type": "string",
      "pattern": "^sha256:[0-9a-f]{64}(?![\\s\\S])",
      "$comment": "sha256 of the canonical serialization of this record with seal set to null."
    }
  },
  "allOf": [
    {
      "if": {
        "required": [
          "council_kind"
        ],
        "properties": {
          "council_kind": {
            "const": "implementation"
          }
        }
      },
      "then": {
        "properties": {
          "binding": {
            "properties": {
              "module_tag": {
                "type": "string",
                "pattern": "^implementation-[1-9]\\d*(?![\\s\\S])"
              }
            }
          }
        }
      }
    },
    {
      "if": {
        "properties": {
          "binding": {
            "properties": {
              "module_tag": {
                "type": "string",
                "pattern": "^implementation-\\d+(?![\\s\\S])"
              }
            }
          }
        }
      },
      "then": {
        "properties": {
          "council_kind": {
            "const": "implementation"
          }
        }
      }
    }
  ]
}
